{
  "client": {
    "url": "http://localhost:8081",
    "readiness_timeout_ms": 15000,
    "stable_frames": 12,
    "maximum_frames": 900,
    "credentials": {
      "user": "drogna_reader",
      "secret_variable": "HARNESS_PROXY_SECRET"
    }
  },
  "viewport": {
    "width": 1440,
    "height": 900,
    "device_scale_factor": 2
  },
  "browser": {
    "name": "chromium",
    "playwright_version": "1.56.1",
    "container_image": ""
  },
  "areas": {
    "glance": ".capture/glance",
    "pair": ".capture/pair",
    "curated_review": ".capture/curated",
    "published": "site/docs/blog/assets"
  },
  "scenario": {
    "seed": 20260826
  },
  "pair": {
    "retention_days": 14,
    "difference_threshold": 0.05,
    "maximum_differing_pixels": 0
  },
  "curated": {
    "maximum_bytes": 2000000,
    "pin_clock": true,
    "masked_selectors": [
      "[data-testid=\"configuration-failure\"]",
      "[data-testid=\"rate-unavailable\"]"
    ]
  }
}
